{
  "schema_version": "cbsp21_patch_manifest_v1",
  "patch_id": "GATE-WRONG-ARTIFACT-001",
  "title": "Gate-validates-wrong-artifact detector (Tier 1 #5)",
  "intent": "Flag a validation gate that inspects something other than the artifact the function ships: green gate, wrong artifact shipped. Two shapes: a value validated and then modified before it is returned (the gate ran before the artifact was final), and a locally built value validated and then abandoned while a different local build is returned (the gate checked the wrong object).",
  "change_type": "code",
  "behavior_change": "compatible",
  "risk_level": "low",
  "scope": {
    "paths_in_scope": [
      "src/code_audit/analyzers/",
      "tests/contracts/"
    ],
    "files_expected_to_change": [
      "src/code_audit/analyzers/gate_wrong_artifact.py",
      "tests/test_gate_wrong_artifact_analyzer.py",
      "src/code_audit/api.py",
      "src/code_audit/model/__init__.py",
      "tests/contracts/confidence_golden_manifest.json",
      "tests/contracts/confidence_policy_manifest.json",
      "tests/contracts/logic_manifest.json"
    ],
    "out_of_scope_notes": "Ship sites are return statements only; write/export sinks and derivation tracing (is the shipped value derived from the validated one?) are left to a v2 pass, flagged by Finding.metadata gate_covers_shipped_confirmed=False. Under-detection is the deliberate trade: the abandoned signal requires the validated name to be a local build (not a parameter) that is entirely unused after the check, so validate(input); return transform(input) is not flagged."
  },
  "diff_range": {
    "base": "3a4717e",
    "head": "working-tree"
  },
  "changed_files_count": 7,
  "changed_files_exact": [
    "src/code_audit/analyzers/gate_wrong_artifact.py",
    "src/code_audit/api.py",
    "src/code_audit/model/__init__.py",
    "tests/contracts/confidence_golden_manifest.json",
    "tests/contracts/confidence_policy_manifest.json",
    "tests/contracts/logic_manifest.json",
    "tests/test_gate_wrong_artifact_analyzer.py"
  ],
  "diff_articulation": {
    "what_changed": [
      "Added src/code_audit/analyzers/gate_wrong_artifact.py (GateWrongArtifactAnalyzer 1.0.0) with two rules: GATE_WRONG_ARTIFACT_MODIFIED_001 (validated, then reassigned or mutated, then returned) and GATE_WRONG_ARTIFACT_ABANDONED_001 (validated local build unused after the check while a different local build is returned). Per-function AST facts, no descent into nested scopes. finding_id is the make_fingerprint value, never empty.",
      "Added AnalyzerType.GATE_WRONG_ARTIFACT and registered the analyzer in api._DEFAULT_ANALYZERS (the registry contract test requires the exact set).",
      "Refreshed confidence_policy, confidence_golden and logic manifests on Python 3.11. The enum value sits in the confidence closure, so the two confidence hashes move; this is a benign closure change, signal_logic_version stays signals_v5.",
      "Merged current main (3a4717e) into the branch, which was cut from 3802ccf. api.py and model/__init__.py conflicted additively (main added four analyzers since); resolved as a union, main's entries first."
    ],
    "why_not_redundant": "No existing analyzer relates a validation call to the value that leaves the function. The shape is the scale-validation defect class from the roadmap: every check passes while the shipped artifact was never checked, so no test or gate observes it."
  },
  "verification": {
    "commands_run": [
      "py -3.11 scripts/refresh_confidence_policy_manifest.py; ... refresh_confidence_golden_manifest.py; ... refresh_logic_manifest.py",
      "PYTHONPATH=<worktree>/src py -3.11 <dogfood: GateWrongArtifactAnalyzer over src/, scripts/, tests/fixtures/repos/*>",
      "CI=true CONFIDENCE_ENTRYPOINTS=src/code_audit/insights/confidence.py PYTHONPATH=<worktree>/src;<worktree> py -3.11 -m pytest -o addopts=\"\" -q -p no:cacheprovider"
    ],
    "test_results": [
      "tests/test_gate_wrong_artifact_analyzer.py: 12 tests covering both bug shapes and the non-flagged validate(input); return transform(input) pattern",
      "Dogfood: 0 findings over 54 validation-named calls in src/ (17) and scripts/ (37) of the merged tree",
      "Fixture repos: 0 findings across tests/fixtures/repos/*, so scan goldens are unchanged",
      "Full suite: see PR"
    ],
    "notes": "Collect-all run (addopts cleared), not maxfail-masked. PYTHONPATH pinned to the worktree so the installed checkout is not imported."
  },
  "file_context_coverage_percent": 100.0,
  "metadata": {
    "author": "Claude Opus 5",
    "created_at": "2026-09-11T00:00:00Z",
    "reviewers": []
  }
}
